{"allowed_mutations":{"external":[],"files":[],"git":[]},"constraints":[{"enforcement":"audit_only","id":"C1","rule":"Commands are previewed but never executed by validation."}],"context_sources":[{"id":"CTX1","path":"/opt/goal-condition-example/worktree/context.md","sha256":"1111111111111111111111111111111111111111111111111111111111111111"}],"judgment_criteria":[{"id":"J1","rule":"The contract is self-contained and uses only declared fields.","why":"A portable runner must not infer missing policy."}],"objective":"Validate a portable goal-condition run contract without executing its commands.","postflight":[{"argv":["node","--version"],"capture":"text","cwd":"/opt/goal-condition-example/worktree","id":"V1","type":"command"}],"preflight":[{"id":"P1","require_clean":true,"target":"/opt/goal-condition-example/worktree","type":"git"}],"runtime":"codex","success_criteria":[{"command":"The validator reports no diagnostics.","expected":"No diagnostics are returned.","id":"S1"}],"target_roots":["/opt/goal-condition-example/worktree"],"version":1}
